<?xml version="1.0" encoding="UTF-8"?>
<?xml-stylesheet type="text/xsl" href="http://lsst-sal.tuc.noao.edu/schema/SALEventSet.xsl"?>
<SALEventSet xmlns:xsi="http://www.w3.org/2001/XMLSchema-instance"
	xsi:noNamespaceSchemaLocation="http://lsst-sal.tuc.noao.edu/schema/SALEventSet.xsd">

<SALEvent>
 <Subsystem>m2ms</Subsystem>
 <Version>3.0</Version>
 <Author>salgenerator</Author>
 <EFDB_Topic>m2ms_logevent_M2SummaryState</EFDB_Topic>
 <Alias>M2SummaryState</Alias>
 <Explanation>http://sal.lsst.org/SAL/Events/m2ms_logevent_M2SummaryState.html</Explanation>
    <item>
      <EFDB_Name>state</EFDB_Name>
      <Description> </Description>
       <IDL_Type>short</IDL_Type>
      <Units> </Units>
      <Count>1</Count>
    </item>
</SALEvent>
<SALEvent>
 <Subsystem>m2ms</Subsystem>
 <Version>3.0</Version>
 <Author>salgenerator</Author>
 <EFDB_Topic>m2ms_logevent_M2DetailedState</EFDB_Topic>
 <Alias>M2DetailedState</Alias>
 <Explanation>http://sal.lsst.org/SAL/Events/m2ms_logevent_M2DetailedState.html</Explanation>
    <item>
      <EFDB_Name>state</EFDB_Name>
      <Description> </Description>
       <IDL_Type>short</IDL_Type>
      <Units> </Units>
      <Count>1</Count>
    </item>
</SALEvent>
<SALEvent>
 <Subsystem>m2ms</Subsystem>
 <Version>3.0</Version>
 <Author>salgenerator</Author>
 <EFDB_Topic>m2ms_logevent_M2FaultState</EFDB_Topic>
 <Alias>M2FaultState</Alias>
 <Explanation>http://sal.lsst.org/SAL/Events/m2ms_logevent_M2FaultState.html</Explanation>
    <item>
      <EFDB_Name>state</EFDB_Name>
      <Description> </Description>
       <IDL_Type>short</IDL_Type>
      <Units> </Units>
      <Enumeration>         ActuatorPlusLimit,ActuatorMinusLimit,ActuatorPlusForceLimit,ActuatorMinusForceLimit,ActuatorCommTimeout,FollowingError,ConfigurationError,UnresponsiveActuator,TangentLinkStrainFault,cRIOCommFailure,cRIOHeartbeatFailure,CurrentError,VoltageError,PowrRelayFault,owerSupplyFault,TemperatureFault, TempSensorFailure,TelescopeElevationault,GravitySensorFailure,ILCFault,CelRBPositionError,DisplacementSensor,ActuatorPlusSoftLimit,ActuatorMinusSoftLimit,CelTemperatureWarning
      </Enumeration>
      <Count>1</Count>
    </item>
</SALEvent>
<SALEvent>
 <Subsystem>m2ms</Subsystem>
 <Version>3.0</Version>
 <Author>salgenerator</Author>
 <EFDB_Topic>m2ms_logevent_M2AssemblyInPosition</EFDB_Topic>
 <Alias>M2AssemblyInPosition</Alias>
 <Explanation>http://sal.lsst.org/SAL/Events/m2ms_logevent_M2AssemblyInPosition.html</Explanation>
    <item>
      <EFDB_Name>inPosition</EFDB_Name>
      <Description> </Description>
       <IDL_Type>boolean</IDL_Type>
      <Units> </Units>
      <Count>1</Count>
    </item>
</SALEvent>
</SALEventSet>
