<?xml version="1.0" encoding="UTF-8"?>
<?xml-stylesheet type="text/xsl" href="http://lsst-sal.tuc.noao.edu/schema/SALEventSet.xsl"?>
<SALEventSet xmlns:xsi="http://www.w3.org/2001/XMLSchema-instance" xsi:noNamespaceSchemaLocation="http://lsst-sal.tuc.noao.edu/schema/SALEventSet.xsd">
  <SALEvent>
    <Subsystem>ESS</Subsystem>
    <EFDB_Topic>ESS_logevent_lightningStrike</EFDB_Topic>
    <Description>Lightning strikes and high electrical field warnings.</Description>
    <item>
      <EFDB_Name>sensorName</EFDB_Name>
      <Description>The name of the sensor.</Description>
      <IDL_Type>string</IDL_Type>
      <Units>unitless</Units>
      <Count>1</Count>
    </item>
    <item>
      <EFDB_Name>strike</EFDB_Name>
      <Description>Lighting strike alarms, as a mask with numStrikeBits bits. 1 means an alarm is active. Higher-order bits are for strikes that are closer, and thus more worrisome. Each alarm will eventually reset itself if no further activity in that alarm range is detected.</Description>
      <IDL_Type>unsigned short</IDL_Type>
      <IDL_Size>1</IDL_Size>
      <Units>unitless</Units>
      <Count>1</Count>
    </item>
    <item>
      <EFDB_Name>highField</EFDB_Name>
      <Description>High electrical field alarms, as a mask with numHighFieldBits bits. 1 means an alarm is active. Higher-order bits are for larger electrical fields, and thus are more worrisome. Each alarm will eventually reset itself if no further activity in that alarm range is detected</Description>
      <IDL_Type>unsigned short</IDL_Type>
      <IDL_Size>1</IDL_Size>
      <Units>unitless</Units>
      <Count>1</Count>
    </item>
    <item>
      <EFDB_Name>numStrikeBits</EFDB_Name>
      <Description>The maximum number of strike bits.</Description>
      <IDL_Type>unsigned short</IDL_Type>
      <IDL_Size>1</IDL_Size>
      <Units>unitless</Units>
      <Count>1</Count>
    </item>
    <item>
      <EFDB_Name>numHighFieldBits</EFDB_Name>
      <Description>The maximum number of high field bits.</Description>
      <IDL_Type>unsigned short</IDL_Type>
      <IDL_Size>1</IDL_Size>
      <Units>unitless</Units>
      <Count>1</Count>
    </item>
    <item>
      <EFDB_Name>status</EFDB_Name>
      <Description>Device status. The details depend on the device, but 0 always means that no problems have been detected.</Description>
      <IDL_Type>short</IDL_Type>
      <IDL_Size>1</IDL_Size>
      <Units>unitless</Units>
      <Count>1</Count>
    </item>
    <item>
      <EFDB_Name>location</EFDB_Name>
      <Description>The location of the sensor.</Description>
      <IDL_Type>string</IDL_Type>
      <Units>unitless</Units>
      <Count>1</Count>
    </item>
  </SALEvent>
  <SALEvent>
    <Subsystem>ESS</Subsystem>
    <EFDB_Topic>ESS_logevent_precipitation</EFDB_Topic>
    <Description>Is it raining or snowing?</Description>
    <item>
      <EFDB_Name>sensorName</EFDB_Name>
      <Description>The name of the sensor.</Description>
      <IDL_Type>string</IDL_Type>
      <Units>unitless</Units>
      <Count>1</Count>
    </item>
    <item>
      <EFDB_Name>raining</EFDB_Name>
      <Description>Is it raining? (true=yes)</Description>
      <IDL_Type>boolean</IDL_Type>
      <IDL_Size>1</IDL_Size>
      <Units>unitless</Units>
      <Count>1</Count>
    </item>
    <item>
      <EFDB_Name>snowing</EFDB_Name>
      <Description>Is it snowing? (true=yes)</Description>
      <IDL_Type>boolean</IDL_Type>
      <IDL_Size>1</IDL_Size>
      <Units>unitless</Units>
      <Count>1</Count>
    </item>
    <item>
      <EFDB_Name>location</EFDB_Name>
      <Description>The location of the sensor.</Description>
      <IDL_Type>string</IDL_Type>
      <Units>unitless</Units>
      <Count>1</Count>
    </item>
  </SALEvent>
</SALEventSet>
