<?xml version="1.0" encoding="UTF-8"?>
<?xml-stylesheet type="text/xsl" href="http://lsst-sal.tuc.noao.edu/schema/SALEventSet.xsl"?>
<SALEventSet xmlns:xsi="http://www.w3.org/2001/XMLSchema-instance"
	xsi:noNamespaceSchemaLocation="http://lsst-sal.tuc.noao.edu/schema/SALEventSet.xsd">
<Enumeration>DetailedState_DisabledState,DetailedState_EnabledState,DetailedState_FaultState,DetailedState_OfflineState,DetailedState_StandbyState</Enumeration>

<SALEvent>
    <Subsystem>MTLaserTracker</Subsystem>
    <Version>3.8.31</Version>
    <Author></Author>
    <EFDB_Topic>MTLaserTracker_logevent_detailedState</EFDB_Topic>
    <Alias>detailedState</Alias>
    <Explanation>http://sal.lsst.org</Explanation>
            <item>
                <EFDB_Name>detailedState</EFDB_Name>
                <Description>Detailed state</Description>
                <!-- Enumeration: DetailedState -->
                <IDL_Type>long</IDL_Type>
                <Units>unitless</Units>
                <Count>1</Count>
            </item>
</SALEvent>
<SALEvent>
    <Subsystem>MTLaserTracker</Subsystem>
    <Version>3.8.31</Version>
    <Author></Author>
    <EFDB_Topic>MTLaserTracker_logevent_heartbeat</EFDB_Topic>
    <Alias>heartbeat</Alias>
    <Explanation>http://sal.lsst.org</Explanation>
    <item>
        <EFDB_Name>heartbeat</EFDB_Name>
        <Description>Heartbeat</Description>
        <IDL_Type>boolean</IDL_Type>
        <Units>unitless</Units>
        <Count>1</Count>
    </item>
</SALEvent>
</SALEventSet>
