<?xml version="1.0" encoding="UTF-8"?>
<?xml-stylesheet type="text/xsl" href="http://lsst-sal.tuc.noao.edu/schema/SALEventSet.xsl"?>
<SALEventSet xmlns:xsi="http://www.w3.org/2001/XMLSchema-instance" xsi:noNamespaceSchemaLocation="http://lsst-sal.tuc.noao.edu/schema/SALEventSet.xsd">
    <Enumeration>DetailedStates_DisabledState,DetailedStates_EnabledState,DetailedStates_FaultState,DetailedStates_OfflineState,DetailedStates_StandbyState</Enumeration>

    <SALEvent>
        <Subsystem>MTM1M3TS</Subsystem>
        <Version>3.8.35</Version>
        <Author></Author>
        <EFDB_Topic>MTM1M3TS_logevent_appliedSetpoint</EFDB_Topic>
        <Alias>appliedSetpoint</Alias>
        <Explanation>http://sal.lsst.org</Explanation>
        <item>
            <EFDB_Name>setpoint</EFDB_Name>
            <Description>Applied setpoint.</Description>
            <IDL_Type>float</IDL_Type>
            <Units>deg_C</Units>
            <Count>1</Count>
        </item>
    </SALEvent>
    <SALEvent>
        <Subsystem>MTM1M3TS</Subsystem>
        <Version>3.8.35</Version>
        <Author></Author>
        <EFDB_Topic>MTM1M3TS_logevent_detailedState</EFDB_Topic>
        <Alias>detailedState</Alias>
        <Explanation>http://sal.lsst.org</Explanation>
        <item>
            <EFDB_Name>detailedState</EFDB_Name>
            <Description>Detailed state of the CSC</Description>
            <IDL_Type>long</IDL_Type>
            <Units>unitless</Units>
            <Count>1</Count>
        </item>
    </SALEvent>
</SALEventSet>
