<?xml version="1.0" encoding="UTF-8"?>
<?xml-stylesheet type="text/xsl" href="http://lsst-sal.tuc.noao.edu/schema/SALEventSet.xsl"?>
<SALEventSet xmlns:xsi="http://www.w3.org/2001/XMLSchema-instance"
    xsi:noNamespaceSchemaLocation="http://lsst-sal.tuc.noao.edu/schema/SALEventSet.xsd">

<SALEvent>
    <Subsystem>MTM2</Subsystem>
    <EFDB_Topic>MTM2_logevent_m2AssemblyInPosition</EFDB_Topic>
    <Alias>m2AssemblyInPosition</Alias>
    <Description>Indicates when all of the M2 axes are within tolerance of the target positions.</Description>
    <item>
        <EFDB_Name>inPosition</EFDB_Name>
        <Description>True if the M2 assembly is in position.</Description>
        <IDL_Type>boolean</IDL_Type>
        <Units>unitless</Units>
        <Count>1</Count>
    </item>
</SALEvent>

<SALEvent>
    <Subsystem>MTM2</Subsystem>
    <EFDB_Topic>MTM2_logevent_cellTemperatureHiWarning</EFDB_Topic>
    <Alias>cellTemperatureHiWarning</Alias>
    <Description>Indicates if the measured cell temperature is more than the specified value above the conditioned supply air temperature.</Description>
    <item>
        <EFDB_Name>hiWarning</EFDB_Name>
        <Description>True if the cell temperature is high.</Description>
        <IDL_Type>boolean</IDL_Type>
        <Units>unitless</Units>
        <Count>1</Count>
    </item>
</SALEvent>

<SALEvent>
    <Subsystem>MTM2</Subsystem>
    <EFDB_Topic>MTM2_logevent_detailedState</EFDB_Topic>
    <Alias>detailedState</Alias>
    <Description>New detailed state on each summary state transition.</Description>
    <item>
        <EFDB_Name>detailedState</EFDB_Name>
        <Description>M2 detailed state.</Description>
        <IDL_Type>long</IDL_Type>
        <Units>unitless</Units>
        <Count>1</Count>
    </item>
</SALEvent>

<SALEvent>
    <Subsystem>MTM2</Subsystem>
    <EFDB_Topic>MTM2_logevent_commandableByDDS</EFDB_Topic>
    <Alias>commandableByDDS</Alias>
    <Description>Can the commandable SAL component (CSC) control the MTM2?</Description>
    <item>
        <EFDB_Name>state</EFDB_Name>
        <Description>If true the CSC can control the MTM2; else the Engineering User Interface has control.</Description>
        <IDL_Type>boolean</IDL_Type>
        <Units>unitless</Units>
        <Count>1</Count>
    </item>
</SALEvent>

<SALEvent>
    <Subsystem>MTM2</Subsystem>
    <EFDB_Topic>MTM2_logevent_interlock</EFDB_Topic>
    <Alias>interlock</Alias>
    <Description>MTM2 interlock: This event is generated when safety interlock is engaged or disengaged</Description>
    <item>
        <EFDB_Name>state</EFDB_Name>
        <Description>True if the interlock is engaged. False if it is cleared.</Description>
        <IDL_Type>boolean</IDL_Type>
        <Units>unitless</Units>
        <Count>1</Count>
    </item>
</SALEvent>

<SALEvent>
    <Subsystem>MTM2</Subsystem>
    <EFDB_Topic>MTM2_logevent_tcpIpConnected</EFDB_Topic>
    <Alias>tcpIpConnected</Alias>
    <Description>State of TCP/IP connection between the server and the low level controller.</Description>
    <item>
        <EFDB_Name>isConnected</EFDB_Name>
        <Description>Is the socket connected (true=yes, false=no)?</Description>
        <IDL_Type>boolean</IDL_Type>
        <Units>unitless</Units>
        <Count>1</Count>
    </item>
</SALEvent>

<SALEvent>
    <Subsystem>MTM2</Subsystem>
    <EFDB_Topic>MTM2_logevent_hardpointList</EFDB_Topic>
    <Alias>hardpointList</Alias>
    <Description>Hardpoint list in the low-level controller.</Description>
    <item>
        <EFDB_Name>actuators</EFDB_Name>
        <Description>Actuator Ids to be the hardpoint.</Description>
        <IDL_Type>unsigned short</IDL_Type>
        <Units>unitless</Units>
        <Count>6</Count>
    </item>
</SALEvent>

</SALEventSet>
