<?xml version="1.0" encoding="UTF-8"?>
<?xml-stylesheet type="text/xsl" href="http://lsst-sal.tuc.noao.edu/schema/SALEventSet.xsl"?>
<SALEventSet xmlns:xsi="http://www.w3.org/2001/XMLSchema-instance" xsi:noNamespaceSchemaLocation="http://lsst-sal.tuc.noao.edu/schema/SALEventSet.xsd">
    <SALEvent>
        <Subsystem>GenericCamera</Subsystem>
        <Version>3.8.41</Version>
        <Author></Author>
        <EFDB_Topic>GenericCamera_logevent_heartbeat</EFDB_Topic>
        <Alias>heartbeat</Alias>
        <Explanation>http://sal.lsst.org</Explanation>
        <item>
            <EFDB_Name>heartbeat</EFDB_Name>
            <Description></Description>
            <IDL_Type>boolean</IDL_Type>
            <Units></Units>
            <Count>1</Count>
        </item>
    </SALEvent>
    <SALEvent>
        <Subsystem>GenericCamera</Subsystem>
        <Version>3.8.41</Version>
        <Author></Author>
        <EFDB_Topic>GenericCamera_logevent_exposureTime</EFDB_Topic>
        <Alias>exposureTime</Alias>
        <Explanation>http://sal.lsst.org</Explanation>
        <item>
            <EFDB_Name>exposureTimeInSec</EFDB_Name>
            <Description>This is the current configured exposure time in seconds.</Description>
            <IDL_Type>double</IDL_Type>
            <Units>seconds</Units>
            <Count>1</Count>
        </item>
    </SALEvent>
    <SALEvent>
        <Subsystem>GenericCamera</Subsystem>
        <Version>3.8.41</Version>
        <Author></Author>
        <EFDB_Topic>GenericCamera_logevent_roi</EFDB_Topic>
        <Alias>roi</Alias>
        <Explanation>http://sal.lsst.org</Explanation>
        <item>
            <EFDB_Name>topPixel</EFDB_Name>
            <Description>This is the regions top most pixel number (base 0).</Description>
            <IDL_Type>int</IDL_Type>
            <Units>pixels</Units>
            <Count>1</Count>
        </item>
        <item>
            <EFDB_Name>leftPixel</EFDB_Name>
            <Description>This is the regions left most pixel number (base 0).</Description>
            <IDL_Type>int</IDL_Type>
            <Units>pixels</Units>
            <Count>1</Count>
        </item>
        <item>
            <EFDB_Name>width</EFDB_Name>
            <Description>This is the regions width in pixels.</Description>
            <IDL_Type>int</IDL_Type>
            <Units>pixels</Units>
            <Count>1</Count>
        </item>
        <item>
            <EFDB_Name>height</EFDB_Name>
            <Description>This is the regions height in pixels.</Description>
            <IDL_Type>int</IDL_Type>
            <Units>pixels</Units>
            <Count>1</Count>
        </item>
    </SALEvent>
    <SALEvent>
        <Subsystem>GenericCamera</Subsystem>
        <Version>3.8.41</Version>
        <Author></Author>
        <EFDB_Topic>GenericCamera_logevent_liveView</EFDB_Topic>
        <Alias>liveView</Alias>
        <Explanation>http://sal.lsst.org</Explanation>
        <item>
            <EFDB_Name>ip</EFDB_Name>
            <Description>This is the ip address for the live view data.</Description>
            <IDL_Type>string</IDL_Type>
            <IDL_Size>1</IDL_Size>
            <Units></Units>
            <Count>1</Count>
        </item>
        <item>
            <EFDB_Name>port</EFDB_Name>
            <Description>This is the TCP port for the live view data.</Description>
            <IDL_Type>int</IDL_Type>
            <Units></Units>
            <Count>1</Count>
        </item>
    </SALEvent>
    <SALEvent>
        <Subsystem>GenericCamera</Subsystem>
        <Version>3.8.41</Version>
        <Author></Author>
        <EFDB_Topic>GenericCamera_logevent_cameraInfo</EFDB_Topic>
        <Alias>cameraInfo</Alias>
        <Explanation>http://sal.lsst.org</Explanation>
        <item>
            <EFDB_Name>cameraMakeAndModel</EFDB_Name>
            <Description>This is the make and model of the current camera.</Description>
            <IDL_Type>string</IDL_Type>
            <IDL_Size>1</IDL_Size>
            <Units></Units>
            <Count>1</Count>
        </item>
    </SALEvent>
    <SALEvent>
        <Subsystem>GenericCamera</Subsystem>
        <Version>3.8.41</Version>
        <Author></Author>
        <EFDB_Topic>GenericCamera_logevent_cameraSpecificProperty</EFDB_Topic>
        <Alias>cameraSpecificProperty</Alias>
        <Explanation>http://sal.lsst.org</Explanation>
        <item>
            <EFDB_Name>propertyName</EFDB_Name>
            <Description>This is the name of the property specific to this camera.</Description>
            <IDL_Type>string</IDL_Type>
            <IDL_Size>1</IDL_Size>
            <Units></Units>
            <Count>1</Count>
        </item>
        <item>
            <EFDB_Name>propertyValue</EFDB_Name>
            <Description>This is the value of the property specific to this camera.</Description>
            <IDL_Type>string</IDL_Type>
            <IDL_Size>1</IDL_Size>
            <Units></Units>
            <Count>1</Count>
        </item>
    </SALEvent>
</SALEventSet>