<?xml version="1.0" encoding="UTF-8"?>
<?xml-stylesheet type="text/xsl" href="http://lsst-sal.tuc.noao.edu/schema/SALEventSet.xsl"?>
<SALEventSet xmlns:xsi="http://www.w3.org/2001/XMLSchema-instance"
	xsi:noNamespaceSchemaLocation="http://lsst-sal.tuc.noao.edu/schema/SALEventSet.xsd">

<SALEvent>
 <Subsystem>tcs</Subsystem>
 <Version>2.5.3</Version>
 <Author>salgenerator</Author>
 <EFDB_Topic>tcs_logevent_wfpDataReady</EFDB_Topic>
 <Alias>wfpDataReady</Alias>
 <Explanation>http://sal.lsst.org/SAL/Events/tcs_logevent_wfpDataReady.html</Explanation>
    <item>
      <EFDB_Name>priority</EFDB_Name>
      <Description>Severity of the event</Description>
      <IDL_Type>long</IDL_Type>
      <Units>NA</Units>
      <Count>1</Count>
    </item>
    <item>
      <EFDB_Name>images_location_URI</EFDB_Name>
      <Description> </Description>
       <IDL_Type>string</IDL_Type>
       <IDL_Size>256</IDL_Size>
      <Units> </Units>
      <Count>1</Count>
    </item>
    <item>
      <EFDB_Name>images_match_URI</EFDB_Name>
      <Description> </Description>
       <IDL_Type>string</IDL_Type>
       <IDL_Size>64</IDL_Size>
      <Units> </Units>
      <Count>1</Count>
    </item>
</SALEvent>

<SALEvent>
 <Subsystem>tcs</Subsystem>
 <Version>2.5.3</Version>
 <Author>salgenerator</Author>
 <EFDB_Topic>tcs_logevent_zemaxError</EFDB_Topic>
 <Alias>zemaxError</Alias>
 <Explanation>http://sal.lsst.org/SAL/Events/tcs_logevent_zemaxError.html</Explanation>
    <item>
      <EFDB_Name>priority</EFDB_Name>
      <Description>Severity of the event</Description>
      <IDL_Type>long</IDL_Type>
      <Units>NA</Units>
      <Count>1</Count>
    </item>
    <item>
      <EFDB_Name>details</EFDB_Name>
      <Description> </Description>
       <IDL_Type>string</IDL_Type>
       <IDL_Size>128</IDL_Size>
      <Units> </Units>
      <Count>1</Count>
    </item>
</SALEvent>
</SALEventSet>
