<?xml version="1.0" encoding="UTF-8"?>
<?xml-stylesheet type="text/xsl" href="http://project.lsst.org/ts/sal_objects/schema/SALEventSet.xsl"?>
<SALEventSet xmlns:xsi="http://www.w3.org/2001/XMLSchema-instance" xsi:noNamespaceSchemaLocation="http://project.lsst.org/ts/sal_objects/schema/SALEventSet.xsd">
  <SALEvent>
    <Subsystem>OCPS</Subsystem>
    <EFDB_Topic>OCPS_logevent_job_result</EFDB_Topic>
    <item>
      <EFDB_Name>job_id</EFDB_Name>
      <Description>Job identifier for async pipeline execution.</Description>
      <IDL_Type>string</IDL_Type>
      <IDL_Size>1</IDL_Size>
      <Units>unitless</Units>
      <Count>1</Count>
    </item>
    <item>
      <EFDB_Name>exit_code</EFDB_Name>
      <Description>Process exit code.</Description>
      <IDL_Type>int</IDL_Type>
      <Units>unitless</Units>
      <Count>1</Count>
    </item>
    <item>
      <EFDB_Name>result</EFDB_Name>
      <Description>Pipeline result as JSON.</Description>
      <IDL_Type>string</IDL_Type>
      <IDL_Size>1</IDL_Size>
      <Units>unitless</Units>
      <Count>1</Count>
    </item>
  </SALEvent>
  <SALEvent>
    <Subsystem>OCPS</Subsystem>
    <EFDB_Topic>OCPS_logevent_job_id</EFDB_Topic>
    <item>
      <EFDB_Name>event_name</EFDB_Name>
      <Description>Triggering event name ("cmd_execute" if from a command).</Description>
      <IDL_Type>string</IDL_Type>
      <IDL_Size>1</IDL_Size>
      <Units>unitless</Units>
      <Count>1</Count>
    </item>
    <item>
      <EFDB_Name>seqNum</EFDB_Name>
      <Description>Sequence number of the event (for linkage).</Description>
      <IDL_Type>int</IDL_Type>
      <Units>unitless</Units>
      <Count>1</Count>
    </item>
    <item>
      <EFDB_Name>job_id</EFDB_Name>
      <Description>Job identifier for async pipeline execution.</Description>
      <IDL_Type>string</IDL_Type>
      <IDL_Size>1</IDL_Size>
      <Units>unitless</Units>
      <Count>1</Count>
    </item>
  </SALEvent>
</SALEventSet>
