<?xml version="1.0" encoding="UTF-8"?>
<?xml-stylesheet type="text/xsl" href="http://lsst-sal.tuc.noao.edu/schema/SALEventSet.xsl"?>
<SALEventSet xmlns:xsi="http://www.w3.org/2001/XMLSchema-instance"
    xsi:noNamespaceSchemaLocation="http://lsst-sal.tuc.noao.edu/schema/SALEventSet.xsd">

<SALEvent>
    <Subsystem>LOVE</Subsystem>
    <EFDB_Topic>LOVE_logevent_observingLog</EFDB_Topic>
    <Alias>observingLog</Alias>
    <Description>A message for the observing log.</Description>
    <item>
        <EFDB_Name>message</EFDB_Name>
        <Description>The message.</Description>
        <IDL_Type>string</IDL_Type>
        <IDL_Size>1</IDL_Size>
        <Units>unitless</Units>
        <Count>1</Count>
    </item>
    <item>
        <EFDB_Name>user</EFDB_Name>
        <Description>Who is the message from?</Description>
        <IDL_Type>string</IDL_Type>
        <IDL_Size>1</IDL_Size>
        <Units>unitless</Units>
        <Count>1</Count>
    </item>
</SALEvent>

</SALEventSet>
