<?xml version="1.0" encoding="UTF-8"?>
<?xml-stylesheet type="text/xsl" href="http://lsst-sal.tuc.noao.edu/schema/SALEventSet.xsl"?>
<SALEventSet xmlns:xsi="http://www.w3.org/2001/XMLSchema-instance"
	xsi:noNamespaceSchemaLocation="http://lsst-sal.tuc.noao.edu/schema/SALEventSet.xsd">

<SALEvent>
 <Subsystem>camera</Subsystem>
 <Version>2.5.2</Version>
 <Author>salgenerator</Author>
 <EFDB_Topic>camera_logevent_ccsConfigured</EFDB_Topic>
 <Alias>ccsConfigured</Alias>
 <Explanation>http://sal.lsst.org/SAL/Events/camera_logevent_ccsConfigured.html</Explanation>
</SALEvent>

<SALEvent>
 <Subsystem>camera</Subsystem>
 <Version>2.5.2</Version>
 <Author>salgenerator</Author>
 <EFDB_Topic>camera_logevent_endInitializeGuider</EFDB_Topic>
 <Alias>endInitializeGuider</Alias>
 <Explanation>http://sal.lsst.org/SAL/Events/camera_logevent_endInitializeGuider.html</Explanation>
</SALEvent>

<SALEvent>
 <Subsystem>camera</Subsystem>
 <Version>2.5.2</Version>
 <Author>salgenerator</Author>
 <EFDB_Topic>camera_logevent_endInitializeImage</EFDB_Topic>
 <Alias>endInitializeImage</Alias>
 <Explanation>http://sal.lsst.org/SAL/Events/camera_logevent_endInitializeImage.html</Explanation>
</SALEvent>

<SALEvent>
 <Subsystem>camera</Subsystem>
 <Version>2.5.2</Version>
 <Author>salgenerator</Author>
 <EFDB_Topic>camera_logevent_endLoadFilter</EFDB_Topic>
 <Alias>endLoadFilter</Alias>
 <Explanation>http://sal.lsst.org/SAL/Events/camera_logevent_endLoadFilter.html</Explanation>
</SALEvent>

<SALEvent>
 <Subsystem>camera</Subsystem>
 <Version>2.5.2</Version>
 <Author>salgenerator</Author>
 <EFDB_Topic>camera_logevent_endReadout</EFDB_Topic>
 <Alias>endReadout</Alias>
 <Explanation>http://sal.lsst.org/SAL/Events/camera_logevent_endReadout.html</Explanation>
</SALEvent>

<SALEvent>
 <Subsystem>camera</Subsystem>
 <Version>2.5.2</Version>
 <Author>salgenerator</Author>
 <EFDB_Topic>camera_logevent_endRotateCarousel</EFDB_Topic>
 <Alias>endRotateCarousel</Alias>
 <Explanation>http://sal.lsst.org/SAL/Events/camera_logevent_endRotateCarousel.html</Explanation>
</SALEvent>

<SALEvent>
 <Subsystem>camera</Subsystem>
 <Version>2.5.2</Version>
 <Author>salgenerator</Author>
 <EFDB_Topic>camera_logevent_endSetFilter</EFDB_Topic>
 <Alias>endSetFilter</Alias>
 <Explanation>http://sal.lsst.org/SAL/Events/camera_logevent_endSetFilter.html</Explanation>
</SALEvent>

<SALEvent>
 <Subsystem>camera</Subsystem>
 <Version>2.5.2</Version>
 <Author>salgenerator</Author>
 <EFDB_Topic>camera_logevent_endShutterClose</EFDB_Topic>
 <Alias>endShutterClose</Alias>
 <Explanation>http://sal.lsst.org/SAL/Events/camera_logevent_endShutterClose.html</Explanation>
</SALEvent>

<SALEvent>
 <Subsystem>camera</Subsystem>
 <Version>2.5.2</Version>
 <Author>salgenerator</Author>
 <EFDB_Topic>camera_logevent_endShutterOpen</EFDB_Topic>
 <Alias>endShutterOpen</Alias>
 <Explanation>http://sal.lsst.org/SAL/Events/camera_logevent_endShutterOpen.html</Explanation>
</SALEvent>

<SALEvent>
 <Subsystem>camera</Subsystem>
 <Version>2.5.2</Version>
 <Author>salgenerator</Author>
 <EFDB_Topic>camera_logevent_endTakeImage</EFDB_Topic>
 <Alias>endTakeImage</Alias>
 <Explanation>http://sal.lsst.org/SAL/Events/camera_logevent_endTakeImage.html</Explanation>
</SALEvent>

<SALEvent>
 <Subsystem>camera</Subsystem>
 <Version>2.5.2</Version>
 <Author>salgenerator</Author>
 <EFDB_Topic>camera_logevent_endUnloadFilter</EFDB_Topic>
 <Alias>endUnloadFilter</Alias>
 <Explanation>http://sal.lsst.org/SAL/Events/camera_logevent_endUnloadFilter.html</Explanation>
</SALEvent>

<SALEvent>
 <Subsystem>camera</Subsystem>
 <Version>2.5.2</Version>
 <Author>salgenerator</Author>
 <EFDB_Topic>camera_logevent_notReadyToTakeImage</EFDB_Topic>
 <Alias>notReadyToTakeImage</Alias>
 <Explanation>http://sal.lsst.org/SAL/Events/camera_logevent_notReadyToTakeImage.html</Explanation>
</SALEvent>

<SALEvent>
 <Subsystem>camera</Subsystem>
 <Version>2.5.2</Version>
 <Author>salgenerator</Author>
 <EFDB_Topic>camera_logevent_prepareToTakeImage</EFDB_Topic>
 <Alias>prepareToTakeImage</Alias>
 <Explanation>http://sal.lsst.org/SAL/Events/camera_logevent_prepareToTakeImage.html</Explanation>
</SALEvent>

<SALEvent>
 <Subsystem>camera</Subsystem>
 <Version>2.5.2</Version>
 <Author>salgenerator</Author>
 <EFDB_Topic>camera_logevent_readyToTakeImage</EFDB_Topic>
 <Alias>readyToTakeImage</Alias>
 <Explanation>http://sal.lsst.org/SAL/Events/camera_logevent_readyToTakeImage.html</Explanation>
</SALEvent>

<SALEvent>
 <Subsystem>camera</Subsystem>
 <Version>2.5.2</Version>
 <Author>salgenerator</Author>
 <EFDB_Topic>camera_logevent_startIntegration</EFDB_Topic>
 <Alias>startIntegration</Alias>
 <Explanation>http://sal.lsst.org/SAL/Events/camera_logevent_startIntegration.html</Explanation>
    <item>
      <EFDB_Name>priority</EFDB_Name>
      <Description>Severity of the event</Description>
      <IDL_Type>long</IDL_Type>
      <Units>NA</Units>
      <Count>1</Count>
    </item>
    <item>
      <EFDB_Name>imageName</EFDB_Name>
      <Description> </Description>
       <IDL_Type>string</IDL_Type>
      <Units> </Units>
      <Count>1</Count>
    </item>
</SALEvent>

<SALEvent>
 <Subsystem>camera</Subsystem>
 <Version>2.5.2</Version>
 <Author>salgenerator</Author>
 <EFDB_Topic>camera_logevent_startLoadFilter</EFDB_Topic>
 <Alias>startLoadFilter</Alias>
 <Explanation>http://sal.lsst.org/SAL/Events/camera_logevent_startLoadFilter.html</Explanation>
</SALEvent>

<SALEvent>
 <Subsystem>camera</Subsystem>
 <Version>2.5.2</Version>
 <Author>salgenerator</Author>
 <EFDB_Topic>camera_logevent_startReadout</EFDB_Topic>
 <Alias>startReadout</Alias>
 <Explanation>http://sal.lsst.org/SAL/Events/camera_logevent_startReadout.html</Explanation>
</SALEvent>

<SALEvent>
 <Subsystem>camera</Subsystem>
 <Version>2.5.2</Version>
 <Author>salgenerator</Author>
 <EFDB_Topic>camera_logevent_startRotateCarousel</EFDB_Topic>
 <Alias>startRotateCarousel</Alias>
 <Explanation>http://sal.lsst.org/SAL/Events/camera_logevent_startRotateCarousel.html</Explanation>
</SALEvent>

<SALEvent>
 <Subsystem>camera</Subsystem>
 <Version>2.5.2</Version>
 <Author>salgenerator</Author>
 <EFDB_Topic>camera_logevent_startSetFilter</EFDB_Topic>
 <Alias>startSetFilter</Alias>
 <Explanation>http://sal.lsst.org/SAL/Events/camera_logevent_startSetFilter.html</Explanation>
</SALEvent>

<SALEvent>
 <Subsystem>camera</Subsystem>
 <Version>2.5.2</Version>
 <Author>salgenerator</Author>
 <EFDB_Topic>camera_logevent_startShutterClose</EFDB_Topic>
 <Alias>startShutterClose</Alias>
 <Explanation>http://sal.lsst.org/SAL/Events/camera_logevent_startShutterClose.html</Explanation>
</SALEvent>

<SALEvent>
 <Subsystem>camera</Subsystem>
 <Version>2.5.2</Version>
 <Author>salgenerator</Author>
 <EFDB_Topic>camera_logevent_startShutterOpen</EFDB_Topic>
 <Alias>startShutterOpen</Alias>
 <Explanation>http://sal.lsst.org/SAL/Events/camera_logevent_startShutterOpen.html</Explanation>
</SALEvent>

<SALEvent>
 <Subsystem>camera</Subsystem>
 <Version>2.5.2</Version>
 <Author>salgenerator</Author>
 <EFDB_Topic>camera_logevent_startUnloadFilter</EFDB_Topic>
 <Alias>startUnloadFilter</Alias>
 <Explanation>http://sal.lsst.org/SAL/Events/camera_logevent_startUnloadFilter.html</Explanation>
</SALEvent>
</SALEventSet>
