<?xml version="1.0" encoding="UTF-8"?>
<?xml-stylesheet type="text/xsl" href="http://lsst-sal.tuc.noao.edu/schema/SALEventSet.xsl"?>
<SALEventSet xmlns:xsi="http://www.w3.org/2001/XMLSchema-instance" xsi:noNamespaceSchemaLocation="http://lsst-sal.tuc.noao.edu/schema/SALEventSet.xsd">
  <Enumeration>Enum_One, Enum_Two, Enum_Three</Enumeration>
  <Enumeration>ValueEnum_Zero=0, ValueEnum_Two=2, ValueEnum_Four=04, ValueEnum_Five=0x05</Enumeration>
  <SALEvent>
    <Subsystem>Test</Subsystem>
    <EFDB_Topic>Test_logevent_scalars</EFDB_Topic>
    <Description>Scalar values.</Description>
    <item>
      <EFDB_Name>boolean0</EFDB_Name>
      <Description>A boolean.</Description>
      <IDL_Type>boolean</IDL_Type>
      <Units>unitless</Units>
      <Count>1</Count>
    </item>
    <item>
      <EFDB_Name>byte0</EFDB_Name>
      <Description>A byte.</Description>
      <IDL_Type>byte</IDL_Type>
      <Units>unitless</Units>
      <Count>1</Count>
    </item>
    <item>
      <EFDB_Name>short0</EFDB_Name>
      <Description>A short.</Description>
      <IDL_Type>short</IDL_Type>
      <Units>unitless</Units>
      <Count>1</Count>
    </item>
    <item>
      <EFDB_Name>int0</EFDB_Name>
      <Description>An int.</Description>
      <IDL_Type>int</IDL_Type>
      <Units>unitless</Units>
      <Count>1</Count>
      <Enumeration>Int0Enum_One, Int0Enum_Two, Int0Enum_Three</Enumeration>
    </item>
    <item>
      <EFDB_Name>long0</EFDB_Name>
      <Description>A long.</Description>
      <IDL_Type>long</IDL_Type>
      <Units>unitless</Units>
      <Count>1</Count>
    </item>
    <item>
      <EFDB_Name>longLong0</EFDB_Name>
      <Description>A long long.</Description>
      <IDL_Type>long long</IDL_Type>
      <Units>unitless</Units>
      <Count>1</Count>
    </item>
    <item>
      <EFDB_Name>unsignedShort0</EFDB_Name>
      <Description>An unsigned short.</Description>
      <IDL_Type>unsigned short</IDL_Type>
      <Units>unitless</Units>
      <Count>1</Count>
    </item>
    <item>
      <EFDB_Name>unsignedInt0</EFDB_Name>
      <Description>An unsigned int.</Description>
      <IDL_Type>unsigned int</IDL_Type>
      <Units>unitless</Units>
      <Count>1</Count>
    </item>
    <item>
      <EFDB_Name>float0</EFDB_Name>
      <Description>A float.</Description>
      <IDL_Type>float</IDL_Type>
      <Units>unitless</Units>
      <Count>1</Count>
    </item>
    <item>
      <EFDB_Name>double0</EFDB_Name>
      <Description>A double.</Description>
      <IDL_Type>double</IDL_Type>
      <Units>unitless</Units>
      <Count>1</Count>
    </item>
    <item>
      <EFDB_Name>string0</EFDB_Name>
      <Description>A string.</Description>
      <IDL_Type>string</IDL_Type>
      <IDL_Size>20</IDL_Size>
      <Units>unitless</Units>
      <Count>1</Count>
    </item>
  </SALEvent>
  <SALEvent>
    <Subsystem>Test</Subsystem>
    <EFDB_Topic>Test_logevent_arrays</EFDB_Topic>
    <Description>Array values.</Description>
    <item>
      <EFDB_Name>boolean0</EFDB_Name>
      <Description>Array of boolean.</Description>
      <IDL_Type>boolean</IDL_Type>
      <Units>unitless</Units>
      <Count>5</Count>
    </item>
    <item>
      <EFDB_Name>byte0</EFDB_Name>
      <Description>Array of byte.</Description>
      <IDL_Type>byte</IDL_Type>
      <Units>unitless</Units>
      <Count>5</Count>
    </item>
    <item>
      <EFDB_Name>short0</EFDB_Name>
      <Description>Array of short.</Description>
      <IDL_Type>short</IDL_Type>
      <Units>unitless</Units>
      <Count>5</Count>
    </item>
    <item>
      <EFDB_Name>int0</EFDB_Name>
      <Description>Array of int.</Description>
      <IDL_Type>int</IDL_Type>
      <Units>unitless</Units>
      <Count>5</Count>
      <Enumeration>Int0ValueEnum_Zero=0, Int0ValueEnum_Two=2, Int0ValueEnum_Four=04, Int0ValueEnum_Five=0x05</Enumeration>
    </item>
    <item>
      <EFDB_Name>long0</EFDB_Name>
      <Description>Array of long.</Description>
      <IDL_Type>long</IDL_Type>
      <Units>unitless</Units>
      <Count>5</Count>
    </item>
    <item>
      <EFDB_Name>longLong0</EFDB_Name>
      <Description>Array of long long.</Description>
      <IDL_Type>long long</IDL_Type>
      <Units>unitless</Units>
      <Count>5</Count>
    </item>
    <item>
      <EFDB_Name>unsignedShort0</EFDB_Name>
      <Description>Array of unsigned short.</Description>
      <IDL_Type>unsigned short</IDL_Type>
      <Units>unitless</Units>
      <Count>5</Count>
    </item>
    <item>
      <EFDB_Name>unsignedInt0</EFDB_Name>
      <Description>Array of unsigned int.</Description>
      <IDL_Type>unsigned int</IDL_Type>
      <Units>unitless</Units>
      <Count>5</Count>
    </item>
    <item>
      <EFDB_Name>float0</EFDB_Name>
      <Description>Array of float.</Description>
      <IDL_Type>float</IDL_Type>
      <Units>unitless</Units>
      <Count>5</Count>
    </item>
    <item>
      <EFDB_Name>double0</EFDB_Name>
      <Description>Array of double.</Description>
      <IDL_Type>double</IDL_Type>
      <Units>unitless</Units>
      <Count>5</Count>
    </item>
  </SALEvent>
</SALEventSet>
