<?xml version="1.0" encoding="UTF-8"?>
<?xml-stylesheet type="text/xsl" href="http://lsst-sal.tuc.noao.edu/schema/SALEventSet.xsl"?>
<SALEventSet xmlns:xsi="http://www.w3.org/2001/XMLSchema-instance" xsi:noNamespaceSchemaLocation="http://lsst-sal.tuc.noao.edu/schema/SALEventSet.xsd">
  <Enumeration>SummaryState_DisabledState,SummaryState_EnabledState,SummaryState_FaultState,SummaryState_OfflineState,SummaryState_StandbyState</Enumeration>
  <Enumeration>DetailedState_DisabledState,DetailedState_EnabledState,DetailedState_FaultState,DetailedState_OfflineState,DetailedState_StandbyState</Enumeration>
  <SALEvent>
    <Subsystem>MTHeaderService</Subsystem>
    <Version>3.8</Version>
    <Author/>
    <EFDB_Topic>MTHeaderService_logevent_largeFileObjectAvailable</EFDB_Topic>
    <Alias>largeFileObjectAvailable</Alias>
    <Explanation>http://sal.lsst.org</Explanation>
    <item>
      <EFDB_Name>url</EFDB_Name>
      <Description>The URL for the Large File Object (LFO)</Description>
      <IDL_Type>string</IDL_Type>
      <IDL_Size>256</IDL_Size>
      <Units>unitless</Units>
      <Count>1</Count>
    </item>
    <item>
      <EFDB_Name>generator</EFDB_Name>
      <Description>The CSCs that Generated the Large File Object (LFO)</Description>
      <IDL_Type>string</IDL_Type>
      <IDL_Size>256</IDL_Size>
      <Units>unitless</Units>
      <Count>1</Count>
    </item>
    <item>
      <EFDB_Name>version</EFDB_Name>
      <Description>The Version of the Large File Object</Description>
      <IDL_Type>float</IDL_Type>
      <Units>unitless</Units>
      <Count>1</Count>
    </item>
    <item>
      <EFDB_Name>checkSum</EFDB_Name>
      <Description>The Checksum of the Large File Object</Description>
      <IDL_Type>string</IDL_Type>
      <IDL_Size>256</IDL_Size>
      <Units>unitless</Units>
      <Count>1</Count>
    </item>
    <item>
      <EFDB_Name>mimeType</EFDB_Name>
      <Description>The MIME Type of the Large File Object (FITS/yaml/etc)</Description>
      <IDL_Type>string</IDL_Type>
      <IDL_Size>256</IDL_Size>
      <Units>unitless</Units>
      <Count>1</Count>
    </item>
    <item>
      <EFDB_Name>byteSize</EFDB_Name>
      <Description>The size of the Large File Object in Bytes</Description>
      <IDL_Type>long</IDL_Type>
      <Units>byte</Units>
      <Count>1</Count>
    </item>
    <item>
      <EFDB_Name>id</EFDB_Name>
      <Description>The Unique ID for the Large File Object</Description>
      <IDL_Type>string</IDL_Type>
      <IDL_Size>256</IDL_Size>
      <Units>unitless</Units>
      <Count>1</Count>
    </item>
  </SALEvent>
</SALEventSet>
